{
  "$schema": "registry.schema.json",
  "schemaVersion": 1,
  "library": "shared-telemetry",
  "releaseUnit": "lokikit-python",
  "package": "lokikit",
  "version": "0.2.0",
  "releaseStatus": "released",
  "wireSchema": "loki-push-v1; inner line not versioned",
  "documents": {
    "entry": "README.md", "usage": "USAGE.md", "integration": "INTEGRATION.md",
    "examples": "EXAMPLES.md", "compatibility": "COMPATIBILITY.md",
    "migration": "MIGRATION.md", "changelog": "CHANGELOG.md"
  },
  "capabilities": [
    {"id": "batch-client", "symbol": "lokikit.LokiClient", "documentation": "USAGE.md", "example": "examples/synthetic.py"},
    {"id": "logging-handler", "symbol": "lokikit.LokiHandler", "documentation": "USAGE.md", "example": "examples/synthetic.py"}
  ]
}
